{
  "schema": "run-control@1",
  "run_id": "20261023T044016Z-fe4512",
  "current_epoch": 1,
  "owner": {
    "kind": "process",
    "owner_id": "222e8204-11bb-44ec-9022-60874d5ccc51",
    "epoch": 1,
    "state": "released",
    "pid": 57196,
    "hostname": "DESKTOP-H56VQB0"
  },
  "updated_at": "2026-10-23T05:27:31.467Z"
}
